author,url,text,section,title,sub_title,date
,https://www.oantagonista.com/brasil/vice-lider-critica-falta-de-apoio-governo-guedes/,"O vice-líder do governo na Câmara, Capitão Augusto, criticou o que chamou de falta de apoio da bancada governista a Paulo Guedes na sessão de ontem da CCJ, registra o UOL.Para o deputado do PR de São Paulo, a audiência –à qual Guedes compareceu para falar da reforma da Previdência– pareceu ser dominada pela oposição, e a “falta de deputados federais para defender o ministro preocupa demais”.Segundo Augusto, os deputados da CCJ não se empenharam por Guedes porque o governo não conseguiu criar boa relação com os parlamentares.“Estamos tomando literalmente chá de banco dos ministros. Reclamação generalizada.”",Brasil,Vice-líder critica falta de apoio do governo a Guedes,,04/04/2019 20:45:10
,https://www.oantagonista.com/sociedade/justica-bloqueia-r-100-milhoes-da-braskem-por-afundamento-de-bairro-em-maceio/,"A Justiça de Alagoas determinou hoje o bloqueio de R$ 100 milhões da Braskem, indústria química do grupo Odebrecht, registra a Folha.O MP e a Defensoria Pública alagoanos haviam solicitado o bloqueio de R$ 6,7 bilhões, mas o juiz Pedro Simões de França limitou o valor a R$ 100 milhões.O objetivo do bloqueio é reparar eventuais danos a moradores do bairro do Pinheiro, em Maceió, onde o solo afundou e há rachaduras nas casas.O problema é  –a empresa nega a acusação.A Promotoria havia pedido também o bloqueio de todas as ações da Braskem negociadas em Bolsa, o que foi negado pelo juiz.",Sociedade,Justiça bloqueia R$ 100 milhões da Braskem por afundamento de bairro em Maceió,,04/04/2019 19:37:30
,https://www.oantagonista.com/mundo/confira-integra-telegrama-itamaraty-onu-em-defesa-movimento-de-1964/," obteve a íntegra do telegrama encaminhado pelo Itamaraty ao argentino Fabian Salvioli, relator independente para a promoção da Verdade, Justiça e Reparação da ONU.No texto, o governo repudia as alegações sem fundamento de Salvioli:",Mundo,Confira a íntegra do telegrama do Itamaraty à ONU em defesa do “movimento de 1964”,,04/04/2019 19:11:55
,https://www.oantagonista.com/brasil/hollerbach-vai-para-casa/,"Ex-sócio de Marcos Valério e condenado com ele no mensalão, Ramon Hollerbach ganhou o direito à progressão de regime e vai passar a cumprir pena de 27 de prisão anos em casa.A decisão foi publicada hoje por Luís Roberto Barroso, do STF, que supervisiona a execução das penas do mensalão. O ministro verificou que o publicitário cumpriu os requisitos.Faltou apenas o pagamento da multa de R$ 5,4 milhões, mas como a defesa alegou que ele não teve rendimentos suficientes para quitar a dívida, a progressão foi concedida, com parecer favorável da PGR.",Brasil,Hollerbach vai para casa,,04/04/2019 19:51:20
,https://www.oantagonista.com/brasil/bolsonaro-pediu-desculpas-por-caneladas-diz-onyx/,"Onyx Lorenzoni disse que Jair Bolsonaro se desculpou por eventuais “caneladas” em políticos em seus encontros com líderes partidários para discutir a reforma da Previdência.“O presidente, com sua humildade, se desculpou de uma canelada aqui, outra acolá”, afirmou o ministro-chefe da Casa Civil, conforme o relato do UOL.Segundo Onyx, todos os líderes de partidos concordaram que é “o momento de passar por cima de nossas diferenças”.",Brasil,"Bolsonaro pediu desculpas por ‘caneladas’, diz Onyx",,04/04/2019 19:19:52
,https://www.oantagonista.com/brasil/moro-brinca-sobre-conta-no-twitter-se-der-errado-culpa-e-de-bolsonaro/,"Durante a live que fez com Jair Bolsonaro no Facebook agora há pouco, Sergio Moro falou sobre a criação de seu perfil pessoal no Twitter –que, neste momento (às 19h58), já está com 276 mil seguidores.O ministro da Justiça disse que a abertura da conta na rede social foi incentivada pelo presidente. E brincou: “Se der errado, a culpa é dele [Bolsonaro]”.",Brasil,"Moro brinca sobre conta no Twitter: se der errado, culpa é de Bolsonaro",,04/04/2019 19:59:03
,https://www.oantagonista.com/brasil/terapia-do-abraco/,"A Casa Civil divulgou fotos do encontro de hoje cedo entre Jair Bolsonaro e os caciques partidários (do toma lá, da cá).O presidente garante que não distribuiu cargos, só abraços.O diálogo será uma marca desse governo: hoje o dia foi de reuniões com presidentes de partidos, sob o comando do nosso capitão . — Casa Civil (@casacivilbr) ",Brasil,Terapia do abraço,,04/04/2019 19:56:55
,https://www.oantagonista.com/brasil/forca-tarefa-da-greenfield-denuncia-13-por-fraudes-com-recursos-de-petros-e-postalis/,"A força-tarefa da Greenfield acaba de denunciar 13 pessoas por fraudes milionárias praticadas no Fundo de Investimento em Direitos Creditórios Trendbank, que captou recursos dos fundos de pensão Petros e Postalis.As investigações revelaram a participação de outras pessoas ligadas às corretoras Finaxis, Planner e ao banco Santander, além do grupo empresarial Rock – do delator Adir Assad.A denúncia aponta crimes contra o sistema financeiro, gestão temerária, fraudulenta, desvio de recursos e a emissão de duplicatas simuladas.Os procuradores da Greenfield pedem, além das condenações dos envolvidos, o pagamento de mais de R$560 milhões como título de reparação econômica e moral às vítimas participantes dos fundos de pensão. O valor é equivalente ao triplo dos aportes realizados nas operações criminosas.Além dos executivos das gestoras, foram denunciados os ex-dirigentes dos fundos – figuras carimbadas indicadas pelo PT e MDB – e Assad, também investigado na Lava Jato.Confira a lista: Adilson Florêncio da Costa, Alexej Predtechensky, Ricardo Oliveira Azevedo, Wagner Pinheiro de Oliveira, Luiz Carlos Fernandes Afonso, Newton Carneiro da Cunha, Maurício França Rubem, Marcelo Andreetto Perillo, Adolpho Julio da Silva Mello Neto, Adir Assad, Edilberto Pereira, Carlos Arnaldo Borges de Souza e Marco Aurélio da Nóbrega.",Brasil,Força-tarefa da Greenfield denuncia 13 por fraudes com recursos de Petros e Postalis,,04/04/2019 18:11:33
,https://www.oantagonista.com/economia/apos-reunioes-de-bolsonaro-com-politicos-bolsa-sobe-193-e-dolar-recua/,"A Bolsa de São Paulo fechou hoje em 96.313 pontos –alta de 1,93%–, enquanto o dólar perdeu força e recuou para R$ 3,8571.Para operadores ouvidos pelo Estadão, os encontros de Jair Bolsonaro com presidentes de partidos para tentar aprovar a reforma da Previdência reverteram o mal-estar de ontem com o embate entre Paulo Guedes e deputados da oposição.",Economia,"Após reuniões de Bolsonaro com políticos, Bolsa sobe 1,93% e dólar recua",,04/04/2019 18:09:13
,https://www.oantagonista.com/brasil/bolsonaro-faz-live-com-sergio-moro/,"Jair Bolsonaro levou Sergio Moro para sua live das quintas-feiras no Facebook, que começou há alguns minutos.O presidente e o ministro da Justiça são acompanhados pelo general Augusto Heleno, “veterano” das lives.Bolsonaro começou dizendo que, nas suas reuniões de hoje com políticos sobre a reforma da Previdência, não tratou de cargos, “como disse a mídia ontem”, mas de projetos para o país e da importância da reforma.Também negou ter gravado os encontros com presidentes de partidos.",Brasil,Bolsonaro faz live com Sergio Moro,,04/04/2019 19:08:03
,https://www.oantagonista.com/brasil/fhc-governo-bolsonaro-e-pior-que-eu-imaginava/,"Em entevista à BBC Brasil, Fernando Henrique Cardoso afirmou que a gestão de Jair Bolsonaro é pior do que ele esperava e, quase cem dias depois da posse, ainda não se viu “nada” do novo governo.“Por que ele foi eleito? Ele falou temas que sensibilizaram: violência e corrupção, basicamente. Temas que pegaram a onda. Mas ele não disse ‘eu vou fazer um Brasil de tal a qual modo’. Tanto que agora ele não sabe o que vai fazer. Vai mudar o quê?”, perguntou o tucano.O ex-presidente fez um autoelogio e disse que, na época da implantação do real, ele “não tinha medo de bicho papão. Fui falar do Plano Real até no programa do Silvio Santos”.“Na reforma da Previdência, o presidente tem que se meter. Ou algum ministro que seja quase presidente”, acrescentou FHC.",Brasil,FHC: governo Bolsonaro é pior do que eu imaginava,,04/04/2019 18:21:03
,https://www.oantagonista.com/brasil/bonde-tigrao-e-contra-chamar-guedes-de-tchutchuca/,"O grupo Bonde do Tigrão, que popularizou o termo “tchutchuca”, divulgou em seu Facebook uma nota lamentando que ele tenha sido usado contra Paulo Guedes.Na nota, o vocalista do grupo, Leandrinho, diz ter ficado “surpreso com o ocorrido” e lamentar o fato de “o deputado em questão [Zeca Dirceu] ter desrespeitado o ministro Paulo Guedes, que além de ser uma autoridade é um senhor de idade e merece respeito”.",Brasil,Bonde do Tigrão é contra chamar Guedes de ‘tchutchuca’,,04/04/2019 17:28:40
,https://www.oantagonista.com/brasil/moro-posta-foto-para-provar-que-seu-twitter-e-seu/,"Sergio Moro, que está com 193 mil seguidores no Twitter no momento em que este post é redigido, acaba de postar uma foto para provar que a conta é dele mesmo.O ministro da Justiça aparece segurando um calendário da Caixa aberto no mês de abril.Pelo visto, o selinho azul de arroba verificada não bastava para convencer todos os seguidores.",Brasil,Moro posta foto para provar que seu Twitter é seu,,04/04/2019 16:58:23
,https://www.oantagonista.com/brasil/tchutchuco-e-tchutchuca/,"Gleisi Hoffmann encontrou Zeca Dirceu no cafezinho da Câmara. “Bom dia, tchutchuco!”, disse ela.Pelo visto, tigrão não é.",Brasil,Tchutchuco e tchutchuca,,04/04/2019 17:14:37
,https://www.oantagonista.com/brasil/juca-diz-que-nao-interessa-ao-mdb-ser-base-de-bolsonaro/,"Romero Jucá, presidente do MDB, deixou o encontro com Jair Bolsonaro, no Palácio do Planalto, dizendo que a conversa foi positiva.O ex-senador afirmou que o partido propôs uma agenda de temas a favor do Brasil e “não nos interessa ser base, mas, sim, aprovar matérias importantes para o País”.“O MDB não quer cargos, não quer fazer parte do governo”, acrescentou.Segundo o Jucá, a sigla é favorável à reforma da Previdência, mas ele ponderou que questões específicas, como BPC e capitalização, serão discutidas.",Brasil,Jucá diz que não interessa ao MDB ser base de Bolsonaro,,04/04/2019 17:41:22
Renan Ramalho,https://www.oantagonista.com/brasil/justificativa-da-oab/,"O novo presidente da OAB, Felipe Santa Cruz, quer usar o tempo que ganhou com o adiamento da decisão do STF sobre a prisão em segunda instância para “revalidar” a posição da entidade.A ideia é submeter a questão novamente ao Conselho Federal, que reúne representantes das seccionais da Ordem em cada estado, e que acabaram de assumir seus mandatos junto com Santa Cruz.A ação contrária à prisão em segunda instância foi apresentada por seu antecessor, Claudio Lamachia, em 2016. Provavelmente, a OAB não vai mudar de posição, mas sim renovar os argumentos para respaldar a posição da nova cúpula.O movimento também é tático, porque a entidade sabe que uma decisão favorável do STF a seu pedido seria duramente criticada na sociedade, pois soltaria Lula e outros condenados.",Brasil,A justificativa da OAB,,04/04/2019 16:27:26
,https://www.oantagonista.com/brasil/e-o-unico-lugar-que-nao-foi-investigado-ainda/,"Eduardo Girão, do Podemos do Ceará, ocupou a tribuna do Senado há pouco para voltar a defender que as cortes superiores sejam investigadas.“Não defendo o fechamento do Supremo. Pelo contrário. Defendo o fortalecimento do Supremo. Mas o STF é o único lugar que não foi investigado ainda.”Davi Alcolumbre deu um jeito de enterrar a CPI da Lava Toga, ao determinar que a CCJ analise o requerimento.",Brasil,“É o único lugar que não foi investigado ainda”,,04/04/2019 15:18:03
,https://www.oantagonista.com/brasil/pelo-jeito-bolsonaro-ouviu-mais-uma-vez-os-militares/,"Romero Jucá saiu do Palácio do Planalto dizendo também que Jair Bolsonaro não falou em velha e nova política, mas em “boa política”.Se é isso mesmo, o presidente ouviu mais uma vez o conselho dos militares.",Brasil,"Pelo jeito, Bolsonaro ouviu (mais uma vez) os militares",,04/04/2019 17:42:47
,https://www.oantagonista.com/brasil/acm-neto-diz-que-dem-pode-fechar-questao-por-reforma/,"ACM Neto saiu de sua reunião com Jair Bolsonaro hoje dizendo que o DEM, partido que preside, pode fechar questão em torno da reforma da Previdência.O prefeito de Salvador não descartou que sua sigla integre formalmente a base do governo no futuro.Leia reportagem em :",Brasil,ACM Neto diz que DEM pode fechar questão por reforma,,04/04/2019 17:44:07
,https://www.oantagonista.com/brasil/procuradoria-acusa-eike-e-cabral-de-improbidade/,"A Procuradoria Geral do Rio de Janeiro (PGE-RJ), que representa o estado na Justiça, denunciou hoje Sérgio Cabral e Eike Batista por improbidade administrativa, informa a GloboNews.A denúncia é baseada na Operação Eficiência, na qual o empresário é investigado por pagar de R$ 64 milhões ao ex-governador para obter contratos junto à administração estadual.Também foram acusados Carlos Miranda, que operava o esquema, e Flavio Godinho, ex-executivo da EBX. A PGE quer o ressarcimento de R$ 327 milhões para os cofres do estado.",Brasil,Procuradoria acusa Eike e Cabral de improbidade,,04/04/2019 17:12:12
,https://www.oantagonista.com/brasil/operacao-em-goias-investiga-loverboy-e-elvis-presley/,"A Operação Decantação, que investiga desvios na Companhia Saneamento de Goiás (Saneago), tem como um dos alvos o empresário Eduardo Henrique de Deus, conhecido como “Loverboy”.Segundo o Ministério Público Federal, ele mantinha numa de suas empresas 21 carimbos de 14 outras empresas, indício de que eram usadas como fantasmas para fraudar licitações.Outro investigado é o pregoeiro Elvis Presley Mendanha, da Comissão de Licitações da Saneago, suspeito de favorecer construtora numa licitação para construção de um parque ecológico.Loverboy está foragido. Ele teve prisão temporária decretada hoje na terceira fase da Decantação, que também investiga envolvimento do ex-governador José Eliton (PSDB) nos desvios da Saneago. ",Brasil,Operação em Goiás investiga Loverboy e Elvis Presley,,04/04/2019 14:25:16
,https://www.oantagonista.com/brasil/laudo-da-pf-confirma-gambiarra-no-museu-nacional/,"A Polícia Federal apresentou hoje laudo pericial que confirma uma gambiarra elétrica como origem do incêndio que destruiu o Museu Nacional no ano passado.Segundo o perito criminal Marco Antônio Zatta, três aparelhos de ar-condicionado estavam ligados a um mesmo disjuntor.“Em vez de ligar direto num quadro principal, foi feita uma ligação em paralelo. Deveria ter um disjuntor para cada ar. Era um mesmo para os três”, disse. Também não havia aterramento elétrico.E quem será responsabilizado?",Brasil,Laudo da PF confirma gambiarra no Museu Nacional,,04/04/2019 17:08:33
,https://www.oantagonista.com/mundo/publicacao-contra-o-hamas-e-pagina-virada-diz-flavio-bolsonaro/,"De volta de Israel, onde fez parte da comitiva do pai, Flávio Bolsonaro disse que sua publicação no Twitter contra o grupo terrorista Hamas –depois apagada– é “página virada”.“Vamos ao que importa ao Brasil. (…) A gente volta cheio de pauta favorável, um monte de acordos. O ministro [Ernesto Araújo] acaba de falar que vai abrir uma agenda agora, talvez no primeiro semestre ainda, para fazer uma rodada junto ao mundo árabe e trazer investimentos”, declarou o senador, segundo a Folha.Questionado pelos jornalistas sobre os motivos que o levaram a apagar o tuíte, Flávio respondeu:“Página virada. Não vão arrancar nada da minha boca. Vamos tratar de pauta positiva, muitos investimentos, vamos parar de ficar jogando casca de banana. O Brasil vai ser grande, vocês querendo ou não.”",Mundo,"Publicação contra o Hamas é página virada, diz Flávio Bolsonaro",,04/04/2019 14:39:53
Diego Amorim,https://www.oantagonista.com/brasil/o-governo-esta-funcionando-onde-tem-milico/,"Um senador que circula bem a Esplanada em razão da frente parlamentar que preside disse a O Antagonista que “o governo só está funcionando onde tem milico”.“É impressionante. São esses generais que têm dado o freio que o Bolsonaro precisa. Estão trabalhando silenciosamente, limpando a área aos poucos.”",Brasil,“O governo só está funcionando onde tem milico”,,04/04/2019 15:04:34
,https://www.oantagonista.com/brasil/petistas-celebram-adiamento-de-toffoli/,"Grande parte do PT comemorou a decisão de Dias Toffoli de tirar da pauta do STF o julgamento da ação sobre prisão em segunda instância, informa Caio Junqueira em .Os petistas acham que, com isso, ganharão tempo na construção de uma maioria que decida favoravelmente a Lula –hoje,, provavelmente a regra atual seria mantida.Leia a reportagem:",Brasil,Petistas celebram adiamento de Toffoli,,04/04/2019 14:52:01
,https://www.oantagonista.com/brasil/governo-diz-onu-que-nao-houve-golpe-em-1964/,"O governo enviou telegrama à ONU negando que houve golpe de Estado no dia 31 de março de 1964 e que a tomada do poder pelos militares contou com o apoio da “maioria da população”, informa a BBC Brasil.O documento diz que o regime militar foi necessário “para afastar a crescente ameaça de uma tomada comunista do Brasil e garantir a preservação das instituições nacionais, no contexto da Guerra Fria”.“Os anos 1960-70 foram um período de intensa mobilização de organizações terroristas de esquerda no Brasil e em toda a América Latina”.",Brasil,Governo diz à ONU que não houve golpe em 1964,,04/04/2019 15:18:09
,https://www.oantagonista.com/brasil/a-linguagem-comunista-de-velez/,"Ricardo Vélez quer que o regime militar instalado em 1964 seja chamado nos livros didáticos de “regime democrático de força”.Isso é linguagem de comunista, para esconder a realidade, assim como o “centralismo democrático” dos antigos PCs. ",Brasil,A linguagem comunista de Vélez,,04/04/2019 15:33:31
,https://www.oantagonista.com/brasil/video-quebra-pau-na-camara-municipal-de-macapa/,"O jornalista amapaense Ney Pantaleão publicou em seu Twitter um pequeno vídeo da eleição para presidente da Câmara Municipal de Macapá.A sessão foi interrompida pelo que os comentaristas de futebol costumam chamar de “cenas lamentáveis” –troca de socos entre os vereadores.E vocês achando que baixaria foi a altercação entre Zeca Dirceu e Paulo Guedes na CCJ da Câmara ontem.(Clique na imagem abaixo para assistir.)Eleição para a presidência da Câmara Municipal de Macapá é interrompida por troca de socos entre vereadores. A briga, literal, pelo poder. — Ney Pantaleão (@NeyPantaleaoTV) ",Brasil,Vídeo: quebra-pau na Câmara Municipal de Macapá,,04/04/2019 15:28:01
,https://www.oantagonista.com/brasil/ventriculo-esquerdo-ou-direito-carlos/,"Carlos Bolsonaro acaba de ir ao Twitter dizer que o “sistema corrupto” insiste em desgastar seu pai e transformá-lo em mais um “boneco de ventrículo”. supõe que o filho de Jair Bolsonaro tenha querido dizer “boneco de ventríloquo” antes de apagar o tuíte.Mas, por via das dúvidas, pergunta: era o ventrículo esquerdo ou o direito, Carluxo?",Brasil,"Ventrículo esquerdo ou direito, Carlos?",,04/04/2019 15:38:27
Diego Amorim,https://www.oantagonista.com/brasil/paulo-guedes-nao-foi-feito-para-politica-diz-deputado-psl/,"O Antagonista conversou com o deputado Coronel Tadeu, do PSL, um dos únicos aliados de Jair Bolsonaro a conseguir perguntar para Paulo Guedes na sessão da CCJ ontem.“O saldo poderia ser muito melhor. Paulo Guedes não foi feito para a política. Ele é técnico, profissional e rápido: tudo o que a política não aceita.”O parlamentar, em seu primeiro mandato, disse que nada justifica a forma desrespeitosa como o ministro foi tratado, mas recomendou que Guedes “aprenda a apanhar”.“Ele não tem sangue de barata. E o cargo de ministro exige tenacidade. Se for se deixar abater por toda porrada que tomar, na política ele não vai ficar. Tem que aprender a apanhar.”",Brasil,"“Paulo Guedes não foi feito para a política”, diz deputado do PSL",,04/04/2019 16:01:32
,https://www.oantagonista.com/brasil/tudo-ocorreu-em-alto-nivel-diz-bolsonaro-sobre-dialogo-com-partidos/,"Jair Bolsonaro foi ao Twitter dizer que “nada se falou sobre cargos” nas conversas com presidentes e líderes de partidos. “Tudo ocorreu em alto nível.”“Executivo e Legislativo unidos, por uma causa que representa o futuro de nossos filhos e netos: a Nova Previdência.”Pela manhã me reuni com vários presidentes e líderes de partidos. Tudo ocorreu em alto nível. Ao contrário do que propalado por alguns, nada se falou sobre cargos. Executivo e Legislativo unidos, por uma causa que representa o futuro de nossos filhos e netos: a Nova Previdência.— Jair M. Bolsonaro (@jairbolsonaro) ",Brasil,"“Tudo ocorreu em alto nível”, diz Bolsonaro sobre diálogo com partidos",,04/04/2019 16:07:14
,https://www.oantagonista.com/brasil/marco-aurelio-ironiza-adiamento/,"Relator das ações que buscam derrubar a prisão em segunda instância, Marco Aurélio Mello ironizou a decisão de Dias Toffoli de adiar, para data indefinida, o dia do julgamento.“É um caso realmente novo, que não estava colocado, né? Talvez por isso deva-se esperar”, disse, segundo registro do Jota.Contrário à execução antecipada da pena, o ministro pressiona pelo julgamento desde 2017.",Brasil,Marco Aurélio ironiza adiamento,,04/04/2019 16:07:41
,https://www.oantagonista.com/brasil/tj-pr-solta-beto-richa/,"A 2ª Câmara Criminal do TJ do Paraná acaba de conceder habeas corpus ao tucano Beto Richa, informa o G1 Paraná.Por dois votos a um, os desembargadores acataram o pedido de liberdade feito pela defesa do ex-governador.",Brasil,TJ-PR solta Beto Richa,,04/04/2019 16:24:44
,https://www.oantagonista.com/brasil/ministro-tse-sera-julgado-na-1a-instancia/,"Celso de Mello mandou à primeira instância de Brasília denúncia contra o ministro do TSE Admar Gonzaga, por suposta agressão à ex-mulher.Foi aplicada o entendimento de que, como o caso não tem relação com o cargo, não há direito ao foro privilegiado no STF.",Brasil,Ministro do TSE será julgado na 1ª instância,,04/04/2019 16:36:20
,https://www.oantagonista.com/brasil/temer-e-filha-viram-reus-por-lavagem/,Michel Temer e a filha Maristela viraram réus por lavagem de dinheiro. Eles são acusados de usar parte da propina de Angra 3 na reforma de um imóvel.Também serão processados o coronel João Batista Lima Filho e a mulher Maria Rita Fratezi.,Brasil,TEMER E FILHA VIRAM RÉUS POR LAVAGEM,,04/04/2019 16:18:59
,https://www.oantagonista.com/brasil/atuacao-dem-incomoda-dirigentes-partidarios/,"Dirigentes de outros partidos começam a se incomodar com a atuação do DEM, que ocupa três ministérios no governo de Jair Bolsonaro, relata Caio Junqueira em .O objetivo do partido de Rodrigo Maia é atrair prefeitos para, na eleição de 2020, superar o MDB em número de prefeituras pelo país.Leia a reportagem:",Brasil,Atuação do DEM incomoda dirigentes partidários,,04/04/2019 16:45:20
,https://www.oantagonista.com/mundo/ex-estrategista-de-trump-volta-atacar-mourao/,"Steve Bannon, ex-estrategista de Donald Trump, disse à Folha que é inaceitável um vice-presidente como Hamilton Mourão manter postura antagônica à de Jair Bolsonaro.“O vice-presidente está tentando mostrar que está preparado se Bolsonaro falhar. E isso não é aceitável. Não é aceitável por ser alguém do governo”, declarou Bannon, que participou da visita de Bolsonaro a Washington no mês passado.“Se quiser fazer isso, Mourão deveria renunciar amanhã de manhã e ir para a oposição”, acrescentou o estrategista.",Mundo,Ex-estrategista de Trump volta a atacar Mourão,,04/04/2019 18:40:02
,https://www.oantagonista.com/brasil/lula-quer-hc-julgado-no-stf-o-mais-breve-possivel/,"A defesa de Lula pediu a Edson Fachin que leve a julgamento na Segunda Turma, “o mais breve possível”, um habeas corpus que pede a anulação da condenação no caso do triplex.O caso foi pautado para análise entre os dias 12 e 23 de abril no plenário virtual, no qual os ministros votam à distância pelo computador.Como há possibilidade de STJ manter a condenação na semana que vem, os advogados querem que o STF se antecipe e decida sobre o habeas corpus numa sessão presencial da Segunda Turma, que se reúne às terças.",Brasil,Lula quer que STF julgue HC ‘o mais breve possível’,,04/04/2019 16:50:35
,https://www.oantagonista.com/brasil/depois-de-13-anos-camara-demite-assessor-acusado-na-operacao-sanguessuga/,"Quase 13 anos depois de a PF deflagrar a Operação Sanguessuga, Rodrigo Maia ordenou a demissão de um dos assessores parlamentares envolvidos no caso.Em 2006, Francisco Machado Filho, o assessor, admitiu que fornecia sua senha para operacionalizar o esquema de fraude em licitações para compra de ambulâncias.Leia a reportagem de Igor Gadelha em :",Brasil,"Depois de 13 anos, Câmara demite assessor acusado na Operação Sanguessuga",,04/04/2019 16:55:05
