author,url,text,section,title,sub_title,date
,https://www.oantagonista.com/brasil/bolsonaro-confirma-troca-de-comando-na-secom/,"Jair Bolsonaro, no café da manhã com jornalistas, confirmou que o publicitário Fábio Wajngarten vai assumir o comando da Secretaria de Comunicação na próxima segunda-feira.“Na Secom, vai ser o Fábio, do meio de vocês. Conheci há dois anos na comunidade israelita. Muitas vezes recorri a ele com dúvidas.”“Tem que melhorar e espero melhorar com o Fábio a partir de segunda”, acrescentou.",Brasil,Bolsonaro confirma troca de comando na Secom,,05/04/2019 10:49:56
,https://www.oantagonista.com/economia/fuga-para-o-paraguai/,"No evento do Lide de João Doria, em Campos do Jordão, empresários comentam nos bastidores que “está muito melhor para investir no Paraguai”, onde custo e burocracia são menores do que no Brasil.Quem já está com um pé no país vizinho é o empresário Flávio Rocha, da Riachuelo.",Economia,A fuga para o Paraguai,,05/04/2019 10:13:42
,https://www.oantagonista.com/brasil/bolsonaro-encerra-casamento-com-velez/,"O noivado de Jair Bolsonaro com Vélez Rodríguez acabou.O presidente disse hoje para jornalistas reunidos no Palácio do Planalto:“Está bastante claro que não está dando certo o ministro Vélez. Na segunda-feira, vamos tirar a aliança da mão direita, ou vai para a esquerda ou vai para a gaveta”",Brasil,Bolsonaro encerra noivado com Vélez,,05/04/2019 10:16:05
Renan Ramalho,https://www.oantagonista.com/brasil/agu-quer-recuperar-r-25-bilhoes-desviados-nos-proximos-2-anos/,"A Advocacia-Geral da União tem como meta recuperar R$ 25 bilhões nos próximos 2 anos em acordos de leniência com empresas investigadas por corrupção.“Nós temos que ser ambiciosos”, disse hoje o chefe do órgão, André Mendonça, ao anunciar a meta, durante café com jornalistas.",Brasil,AGU quer recuperar R$ 25 bilhões desviados nos próximos 2 anos,,05/04/2019 10:18:49
,https://www.oantagonista.com/economia/reforma-reforma-e-reforma/,"No evento do Lide de João Doria em Campos de Jordão, só se fala na reforma da Previdência.Nos bastidores, empresários temem o tamanho da desidratação da proposta pelo Congresso e comentam o que consideram “erros de condução” na articulação política.Os ministros Paulo Guedes, Ricardo Vélez e Ricardo Salles participam hoje da programação. Rodrigo Maia e Davi Alcolumbre, além de cinco governadores, também vão estar presentes ao longo do evento.",Economia,"Reforma, reforma e reforma",,05/04/2019 10:06:23
,https://www.oantagonista.com/brasil/ele-disse-que-errou/,"Paulo Guedes vai tentar se controlar mais nos próximos embates com parlamentares.O senador Jorge Kajuru disse ao Estadão depois de se reunir com o ministro:“Ele disse que errou e que não devia ter respondido e que a partir de agora não vai mais fazer isso. Disse que já estava preparado para as ofensas, só não imaginava o nível.”",Brasil,“Ele disse que errou”,,05/04/2019 10:24:24
,https://www.oantagonista.com/brasil/kajuru-se-eu-visse-gilmar-sairia-voando/,"Jorge Kajuru foi perguntado pela Veja se o governo atuou contra a CPI da Lava Toga.Ele respondeu:“Parte dele foi contra. Fui ao gabinete de Flávio Bolsonaro há quatro semanas e ele perguntou: ‘Kajuru, você quer criar uma crise?’. Outro senador me disse que não apoia a CPI porque receber Gilmar Mendes toda semana para jantar. Até me convidou, mas respondi: ‘Pássaros e porcos não se sentam à mesma mesa. Se eu visse Gilmar, sairia voando’”.A esse propósito,  do senador Alessandro Vieira na .",Brasil,"Kajuru: “Se eu visse Gilmar, sairia voando”",,05/04/2019 10:11:35
,https://www.oantagonista.com/brasil/quem-pode-soltar-lula/,"Quem pode soltar Lula?A  conta que a rádio-corredor dos ministros do STJ registra que é grande a pressão sobre os ombros do ministro Reynaldo Soares da Fonseca, um dos cinco integrantes da turma que julgará o recurso que pode tirar Lula da cadeia.Leia a nota completa .",Brasil,Quem pode soltar Lula?,,05/04/2019 09:53:27
,https://www.oantagonista.com/economia/salario-minimo-sem-aumento-real-2/,"Jair Bolsonaro quer que o salário mínimo seja corrigido apenas pela inflação, sem aumento real.O Globo diz que, segundo estimativas da equipe econômica, “o impacto positivo no próximo ano pode chegar a 7,6 bilhões de reais”. ",Economia,Salário mínimo sem aumento real,,05/04/2019 09:45:44
Renan Ramalho,https://www.oantagonista.com/brasil/relator-pacote-anticrime-no-senado-quer-aprovar-ate-maio-prisao-em-2a-instancia/,"Relator do maior parte do pacote anticrime no Senado, Marcos do Val (PPS-ES) disse a  que planeja aprovar até maio a prisão em segunda instância, da qual disse não abrir mão.Se na Câmara, mesmo os deputados aliados do governo já admitem deixar a medida pelo caminho para salvar o restante do pacote, Marcos do Val considera que ela é essencial.“Se não for aprovada a prisão em segunda instância, não vai adiantar aumentar as penalidades se os condenados vão continuar soltos até prescrever”, resumiu o senador, estreante no Parlamento.Ele vê clima mais favorável entre os senadores para aprovar a proposta que entre deputados. E diz que o adiamento da decisão sobre a questão no STF não interfere nos planos de aprovação.“O que está acontecendo na nossa Casa é que os senadores não estão admitindo STF e STJ legislando”, afirmou.",Brasil,Relator do pacote anticrime no Senado quer aprovar até maio prisão em 2ª instância,,05/04/2019 10:00:27
,https://www.oantagonista.com/brasil/exercito-robotizado/,"Um levantamento da NetLab, feito a pedido da Veja, concluiu que, “dos vinte campeões de postagens pró-Bolsonaro no Twitter, seis eram claramente robôs e outros nove apresentavam movimentação altamente suspeita.O exército robotizado faz as postagens de Bolsonaro chegar a um público maior do que os seus 26,9 milhões de seguidores nas redes sociais”.",Brasil,Exército robotizado,,05/04/2019 09:39:07
,https://www.oantagonista.com/brasil/qual-o-crime-de-magno-malta/,"Uma liderança do PR até hoje se pergunta sobre por que Magno Malta não conseguiu nada no governo.“Ainda não consigo entender. Ele esteve ao lado do Jair Bolsonaro o tempo todo, desde o início, e ficou sem nada. Que crime tão grave o Malta cometeu? Ninguém nunca soube me responder.”",Brasil,Qual o crime de Magno Malta?,,05/04/2019 09:30:12
,https://www.oantagonista.com/brasil/estou-preparado-para-governar-o-nosso-pais/,"O governador do Rio de Janeiro, Wilson Witzel, anunciou mais uma vez que pretende se candidatar ao Palácio do Planalto.Ele disse à BBC:“Eu estudei a minha vida inteira, estou preparado para governar o Rio de Janeiro e estou preparado para governar o nosso país. Fiz mestrado, estou terminando meu doutorado e não paro de estudar nunca. Acho que o Brasil precisa sempre de líderes que possam dar as gerações futuras melhores oportunidades. É isso que quero fazer pelo nosso país. A vida é feita de planejamento. O presidente Bolsonaro tem meu respeito. Se ele não for candidato, eu quero dar continuidade a um projeto de transformação do Brasil e resgate da economia do nosso país. O Ministro Paulo Guedes pensa exatamente como eu penso. Temos que ter maior liberalismo econômico, atrair o capital estrangeiro, investir em infraestrutura.”",Brasil,“Estou preparado para governar o nosso país”,,05/04/2019 09:18:32
,https://www.oantagonista.com/brasil/cabral-diz-que-propina-dos-onibus-comecou-com-moreira-franco/,"No depoimento espontâneo que presta hoje, Sérgio Cabral disse que a propina de empresas de transportes no Rio começou a ser paga no governo Moreira Franco e passou pelas gestões de Leonel Brizola e Anthony Garotinho, informa o G1.A “caixinha da Fetranspor”, segundo ele, era dividida entre Executivo e Legislativo do estado, mas também chegou à Câmara dos Vereadores.Disse que no governo Brizola, o secretário de Transportes Pedro Valente administrava o esquema, com “aval” do governador. Cabral assumiu o comando em 1995, quando presidiu a Alerj.“Moreira Franco é o governador, em 1987 e em 1990 é feita a recuperação das empresas (de transporte). Cria-se na Alerj a primeira propina instituída para o deputado Gilberto Rodrigues, presidente da Alerj e, do ponto de vista jurídico, o procurador de justiça (do Ministério Público) Carlo Navega dava soluções jurídicas na volta às suas mãos particulares. Ele colaborou com o retorno das empresas às mãos (dos empresários), e recebia junto com o governador Moreira Franco e (com o deputado) Gilberto Rodrigues, junto com o deputado Claudio Moacir, e membros do Tribunal de Justiça”, disse Cabral.Cabral comandou a Companhia Estadual de Turismo (TurisRio) no governo de Moreira Franco.",Brasil,Cabral diz que propina dos ônibus começou com Moreira Franco,,05/04/2019 15:08:05
,https://www.oantagonista.com/brasil/parlamentarismo-tchuchuca/,"“Nas últimas semanas”, diz Raquel Landim, “cresceram as articulações diretas dos grandes empresários junto aos principais líderes no Congresso, com destaque para Rodrigo Maia, para instituir um parlamentarismo informal.O objetivo é viabilizar a reforma da Previdência e, na sequência, a reforma tributária e isolar o presidente Jair Bolsonaro, deixando Paulo Guedes como uma espécie de primeiro-ministro”.",Brasil,Parlamentarismo tchuchuca,,05/04/2019 08:19:19
,https://www.oantagonista.com/brasil/o-aprendiz-3/,João Doria disse para o Valor que o PSDB não será mais um “depósito de derrotados” nem de “desempregados”.Ele rejeitou também a proposta de “rodízio” no comando do partido e avisou que “quem tem voto” mandará na sigla.,Brasil,O Aprendiz,,05/04/2019 08:55:36
,https://www.oantagonista.com/brasil/o-primeiro-demitido-por-velez/,"A primeira demissão no MEC ocorreu antes mesmo de o ano virar e o novo governo assumir.Depois de participar de toda a transição, o cientista político Antônio Flávio Testa, que havia sido indicado para ser o número 2 da pasta como secretário-executivo, foi chamado por Ricardo Vélez, que disse estar “incomodado” com sua postura e o afastou do grupo.Era apenas o início dos rompantes do colombiano, que até agora não conseguiu montar uma equipe sólida.No Congresso, até apoiadores de Jair Bolsonaro já começaram a reconhecer que é preciso pressionar o presidente para aprimorar a gestão no ministério — .",Brasil,O primeiro demitido por Vélez,,05/04/2019 08:30:07
,https://www.oantagonista.com/brasil/tv-olavete/,"Os olavetes demitidos do MEC arrumaram uma boquinha na TV Escola.“O canal de comunicação financiado pelo MEC é gerido pela Associação de Comunicação Educativa Roquette Pinto, organização social que recebeu 92,6 milhões de reais dos cofres públicos federais no ano passado”, diz O Globo.Os olavetes são Tiago Tondinelli, Eduardo Freire de Melo e Rodrigo de Almeida Morais.",Brasil,TV Olavete,,05/04/2019 08:44:10
Diego Amorim,https://www.oantagonista.com/brasil/bolsonaro-recebera-liderancas-pr-sem-valdemar/,"Na próxima terça-feira, será a vez de Jair Bolsonaro receber dirigentes e lideranças do PR, que tem 38 deputados e 2 senadores.A comitiva do partido será formada pelo ex-ministro Alfredo Nascimento, pelos senadores Jorginho Mello e Wellington Fagundes, pelo presidente da legenda, José Tadeu Candelária, e pelo novo líder na Câmara, deputado Wellington Roberto.Valdemar Costa Neto, quem de fato ainda comanda as articulações do partido, não vai pisar no Palácio do Planalto.“Vamos ouvir. Até porque o convite foi formulado pelo governo. Quem convida tem que pagar a conta. O presidente que vai ter que dizer por que nos convidou”, disse Roberto a .O líder acrescentou que não há chance de o PR fechar questão sobre a reforma da Previdência — o partido é contra, por exemplo, as mudanças no BPC, na aposentadoria rural e dos professores.",Brasil,Bolsonaro receberá lideranças do PR (sem Valdemar),,05/04/2019 08:00:11
,https://www.oantagonista.com/brasil/a-farra-do-boi/,"A PF grampeou Joesley Batista no dia do triunfo eleitoral de Dilma Rousseff, em 2014.A  obteve esses grampos inéditos.Joesley Batista e Ricardo Saud comemoram o resultado com Michel Temer, Fernando Pimentel, Eduardo Cunha, Henrique Meirelles e com o assessor de Edinho Silva.A reportagem da , com os áudios dos protagonistas, revelam a promiscuidade da JBS com o poder.Leia – e escute – . ",Brasil,A farra do boi,,05/04/2019 08:33:04
,https://www.oantagonista.com/brasil/os-telefonemas-de-toffoli-e-gilmar/,"Alessandro Vieira, em entrevista à , contou que todos os senadores receberam telefonemas para enterrar a CPI da Lava Toga.De quem?“Do Toffoli, do Gilmar. Um senador me disse que outro ministro também ligou. E os argumentos contra a CPI foram se amoldando. Primeiro, que não podia ter CPI porque juridicamente não era possível. Depois, foram mudando para a história de uma crise institucional que poderia parar o país. Em alguns casos, a movimentação era triangular. Ministros do Supremo pediam a outras pessoas para pressionarem. Em vez de o ministro ligar diretamente, ele pedia para alguém que tinha influência sobre o senador ligar. O empresário Benjamin Steinbruch, por exemplo, ligou para o Cid Gomes. Duas senadoras do PSL, Soraya (Thronicke) e Selma (Arruda), foram muito pressionadas pelo Flávio Bolsonaro. Ele não assinou a CPI. Primeiro, disse que não assinava para não comprometer o pai. E depois passou abertamente a defender que não tivesse CPI para não gerar uma crise institucional.”A entrevista completa pode ser lida .",Brasil,Os telefonemas de Toffoli e Gilmar,,05/04/2019 09:08:24
,https://www.oantagonista.com/brasil/pf-continua-investigar-esfaqueador-de-bolsonaro/,"A  acompanha de perto o inquérito da PF sobre Adélio Bispo, o homem que tentou assassinar Jair Bolsonaro.Ainda há investigações em curso para averiguar as suspeitas da polícia de que o PCC teria alguma relação com o caso.Leia a nota completa .",Brasil,PF continua a investigar esfaqueador de Bolsonaro,,05/04/2019 08:00:43
,https://www.oantagonista.com/brasil/o-novo-lider-2/,"O PRB tem grandes chances de assumir a liderança do governo na Câmara, diz a .Além de João Campos, o deputado baiano João Roma também está no páreo para ser o sucessor de Major Vitor Hugo, do PSL, atual líder.Leia a nota completa .",Brasil,O novo líder,,05/04/2019 08:05:48
,https://www.oantagonista.com/brasil/os-banqueiros-pt/,"A Lava Jato vem tentando ouvir Lula na investigação que mira a relação de banqueiros com o PT, diz a .Os advogados do petista, porém, estão fazendo de tudo para evitar.Leia a nota completa .",Brasil,Os banqueiros do PT,,05/04/2019 08:14:00
,https://www.oantagonista.com/brasil/bolsonaro-e-novo-2/,"A pesquisa da XP tem um dado positivo para Jair Bolsonaro: 62% dos entrevistados responderam que ele representa a nova política.Quando perguntados sobre o que caracterizaria uma nova política, o combate à corrupção apareceu em primeiro lugar, com 74%.",Brasil,Bolsonaro é novo,,05/04/2019 07:31:17
,https://www.oantagonista.com/sociedade/ana-paula-e-o-politicamente-insano/,"Ana Paula Henkel escreveu para a  uma coluna imperdível sobre Tiffany.Leia um trechinho:“Para quem não acompanha o vôlei feminino brasileiro, Tiffany, que foi Rodrigo na maior parte da sua vida, tem 34 anos. Há pouco mais de dois anos tem níveis de testosterona compatíveis com o esporte feminino, mas por três décadas, quando jogava vôlei em ligas profissionais como Rodrigo, construiu um corpo de 1,94m de estrutura e músculos masculinos. É justo que agora participe de competições com quem é mulher desde que nasceu, que tem ossos, músculos, ligamentos e capacidade aeróbica tipicamente femininas? Você sabe a resposta.”A coluna completa pode (e deve) ser lida .",Sociedade,Ana Paula e o politicamente insano,,05/04/2019 07:47:57
,https://www.oantagonista.com/brasil/pf-no-rastro-ministro-turismo/,"O ministro do Turismo ainda não foi demitido, provocando um desgaste desnecessário ao governo.Nesta sexta-feira, a Folha de S. Paulo informa que a PF “vê elementos de participação de Marcelo Álvaro Antônio no esquema de candidaturas de laranjas do PSL em Minas Gerais na eleição de 2018.Investigadores apuram inicialmente a suspeita do crime de falsidade ideológica. Outro crime em apuração é o de lavagem de dinheiro.”",Brasil,PF no rastro do ministro do Turismo,,05/04/2019 06:38:06
,https://www.oantagonista.com/brasil/a-caravana-passa-3/,"O coordenador da caravana “Lula Livre com Fernando Haddad” já se prepara para o fracasso.Ele disse para o Valor:“Não tem como ser no padrão de mobilização como era com Lula. Só ele consegue aquele público.”Gleisi Hoffmann concorda:“Mas é importante para mostrar a nossa solidariedade, defender a liberdade de Lula e reforçar que essa prisão é uma barbaridade.”",Brasil,A caravana esvaziada,,05/04/2019 07:05:52
,https://www.oantagonista.com/brasil/bolsonaro-perde-mais-4-pontos/,"Jair Bolsonaro, segundo a pesquisa da XP, está caindo mais lentamente.Ele é considerado bom ou ótimo por 35% do eleitorado (eram 37% no mês passado) e ruim ou péssimo por 26% (eram 24%).",Brasil,Bolsonaro perde mais 4 pontos,,05/04/2019 07:20:55
,https://www.oantagonista.com/brasil/cem-dias-de-pesquisas/,"Os cem dias de Jair Bolsonaro estão sendo comemorados com uma série de pesquisas.As taxas de ótimo ou bom, até agora, foram as seguintes:– 34% (Ibope)– 36% (Ipespe)– 38% (Ideia Big Data)– 30,5% (Atlas Político)",Brasil,Cem dias de pesquisas,,05/04/2019 06:54:45
Renan Ramalho,https://www.oantagonista.com/brasil/armadilha-de-jaques-wagner-para-o-pacote-anticrime/,"Uma emenda apresentada por Jaques Wagner (PT-BA) no pacote anticrime poderá, se aprovada, diminuir de 12 para 5 anos a pena máxima do crime de corrupção, caso a propina seja paga como doação não declarada de campanha.A armadilha está no projeto que define de forma mais precisa o crime de caixa 2 e vai na direção oposta ao que propôs o ministro Sergio Moro.O texto original deixa mais claro que o recebimento de recursos não contabilizados para campanha é um crime eleitoral, com pena de 2 a 5 anos de prisão.Mas também estabelece que, se houver contrapartida à doação eleitoral, o político deixa de ser punido por caixa 2 para ser enquadrado por corrupção, cuja pena varia de 5 a 12 anos de prisão, conforme o Código Penal.Se há tentativa de esconder o pagamento, aplicam-se mais 3 a 10 anos por lavagem de dinheiro.Na prática, a emenda de Wagner propõe que a punição do caixa 2 se aplique a atos de corrupção e lavagem, se o político conseguir provar que o dinheiro era destinado à sua campanha.",Brasil,A armadilha de Jaques Wagner para o pacote anticrime,,05/04/2019 07:30:28
Renan Ramalho,https://www.oantagonista.com/brasil/moraes-quer-saber-destino-de-todo-o-dinheiro-pago-em-condenacoes/,"Alexandre de Moraes requisitou a todos os tribunais do país informações sobre o destino do dinheiro pago por condenados em multas e ressarcimentos por desvios e prejuízos aos cofres públicos.A ordem foi emitida dentro da ação na qual PT e PDT questionam o poder do Ministério Público para direcionar a aplicação dos recursos, como foi feito na criação de um fundo com R$ 1,25 bilhão pagos pela Petrobras.O ministro é relator da ação, que busca dar à União o poder sobre os recursos.",Brasil,Moraes quer saber destino de todo o dinheiro pago em condenações,,05/04/2019 07:00:16
,https://www.oantagonista.com/economia/brexit-adiado-2/,A União Européia ofereceu o adiamento do Brexit por um ano.Theresa May pediu prazo até 30 de junho.,Economia,Brexit adiado,,05/04/2019 05:42:05
,https://www.oantagonista.com/brasil/doleiro-foragido-muda-o-rosto/,"Foragido desde maio passado, Dario Messer, o doleiro dos doleiros, “fez uma transformação total de sua face” e “está irreconhecível”, informa Lauro Jardim, n’O Globo.Segundo o colunista ouviu de um interlocutor, ele não precisou de cirurgia plástica.",Brasil,Doleiro foragido muda o rosto,,04/04/2019 21:30:41
,https://www.oantagonista.com/brasil/gleisi-contavamos-que-lula-seria-solto-agora/,"Gleisi Hoffmann contava com a soltura de Lula na semana que vem, com o julgamento do STF.Ela disse para o Valor:“Estamos apreensivos com esse adiamento. Contávamos que Lula seria solto agora, para abreviar o calvário na prisão. Quanto mais demora, mais fica difícil.”",Brasil,Gleisi: “Contávamos que Lula seria solto agora”,,05/04/2019 06:09:03
,https://www.oantagonista.com/brasil/o-que-falta-temer/,"Em entrevista à Bandeirantes, Michel Temer jurou inocência de todas as acusações que lhe são feitas.Ele também disse que não voltará à vida pública, porque já foi tudo.Quase tudo. Só falta ser presidiário em tempo integral, caso venha a ser condenado. ",Brasil,O que falta a Temer,,04/04/2019 23:12:24
,https://www.oantagonista.com/brasil/moro-2022-2026/,"Sergio Moro, em menos de 24 horas, conseguiu 381 mil seguidores no Twitter.A meta imediata é aprovar o pacote anticrime. Mas a carreira dele vai longe.",Brasil,"Moro 2022, 2026…",,05/04/2019 06:05:14
,https://www.oantagonista.com/brasil/vamos-abrir-caixa-preta-judiciario/,"O senador Alessandro Vieira, em entrevista à , disse que a CPI da Lava Toga ainda pode sair:“A perspectiva é positiva. Vamos aguardar o parecer na CCJ e buscar apoio lá dentro. O movimento do PT e MDB é forte, contrário à CPI. Mas acredito em uma análise mais técnica na CCJ. Sigo dizendo que é questão de tempo. Acredito que ela sairá. Vamos abrir a caixa-preta do Judiciário.”Os mais de 70 mil assinantes da  podem ler a entrevista completa .",Brasil,“Vamos abrir a caixa-preta do Judiciário”,,05/04/2019 06:16:30
,https://www.oantagonista.com/brasil/mesmas-de-antes/,"Confira a  da denúncia do MPF contra 13 ex-executivos de gestoras, bancos e corretoras, além de ex-dirigentes dos fundos Petros e Postalis – indicados pelo PT e pelo MDB.Trendbank e Planner são velhas conhecidas de escândalos políticos anteriores, como Banestado e Mensalão. A Greenfield também fisgou o Santander, citado na delação de Antonio Palocci.",Brasil,As mesmas de antes,,04/04/2019 20:02:48
,https://www.oantagonista.com/brasil/flavio-bolsonaro-quer-criminalizar-arrastao/,"O senador Flávio Bolsonaro apresentou projeto para criminalizar o arrastão, com penas de 6 a 12 anos de prisão. Caso o crime resulte em morte, a pena pode ir de 20 a 30 anos de cadeia.Na justificativa da proposta, Bolsonaro esclarece o que é o arrastão:“É um crime comumente praticado em locais abetos ao público, como praias e shoppings centers, por um grupo de criminosos que, valendo-se do elemento surpresa, furtam ou roubam o público presente no local, por meio de ações múltiplas, coletivas, continuadas, rápidas e com emprego de violência ou ameaça intimidadora.”Ainda segundo o texto, o arrastão também costuma acontecer “no interior de ônibus, trens, metrô e outros meios de transporte coletivos e, ainda, em engarrafamentos, vias de acesso, marginais, rodovias”. Também ocorre em restaurantes, rádios etc.Em praticamente todos os lugares do país.   ",Brasil,Flávio Bolsonaro quer criminalizar arrastão,,04/04/2019 20:23:04
,https://www.oantagonista.com/mundo/de-cada-4-venezuelanos-1-precisa-de-ajuda-humanitaria-urgente/,"Um documento de 45 páginas vazado da ONU calcula que 7 milhões de venezuelanos –ou seja, uma de cada quatro pessoas no país– precisem de ajuda humanitária urgente.“É uma situação insuportável que só se compara com a de países e guerra”, disse a Duda Teixeira, de , o pesquisador César Muñoz, da Human Rights Watch.Leia a reportagem:",Mundo,"De cada 4 venezuelanos, 1 precisa de ajuda humanitária urgente",,04/04/2019 21:00:58
,https://www.oantagonista.com/brasil/alexandre-de-moraes-bate-boca-com-pf-em-aeroporto/,"Alexandre de Moraes teve um entrevero com a PF antes de embarcar em seu voo na terça passada no aeroporto de Brasília, relata Bela Megale em O Globo.Segundo a repórter, o ministro do STF não permitiu que um funcionário passasse nele o aparelho detector de metais e seguiu para o avião. A recusa fez com que a PF fosse acionada.Um delegado e um agente foram até a aeronave onde Moraes já estava e explicaram que ele não poderia ser dispensado do procedimento.Irritado, o ministro acabou cedendo enquanto reclamava da PF em voz alta. ",Brasil,Alexandre de Moraes bate boca com PF em aeroporto,,04/04/2019 20:30:31
,https://www.oantagonista.com/brasil/bolsonaro-diz-que-13o-bolsa-familia-sera-pago-no-final-deste-ano/,"Jair Bolsonaro anunciou a implementação neste ano de uma das promessas de campanha: o 13º do Bolsa Família.“Está garantido no final do ano”, afirmou o presidente em sua live no Facebook.Será usado dinheiro recuperado de ações contra fraudes.",Brasil,Bolsonaro diz que 13º do Bolsa Família será pago no final deste ano,,04/04/2019 21:26:26
