author,url,text,section,title,sub_title,date
,https://www.oantagonista.com/brasil/santos-cruz-olavo-de-carvalho-nao-tem-importancia-nenhuma/,"Em entrevista à BBC nos EUA, onde participa da Brazil Conference, o general Carlos Alberto dos Santos Cruz disse que Olavo de Carvalho “não tem importância nenhuma”.“Se eu me interessasse por ele, poderia dizer alguma coisa. Mas sinceramente não tenho nem curiosidade”, declarou o ministro-chefe da Secretaria de Governo, alvo de ataques do escritor apontado como “guru” do bolsonarismo.Em uma sequência de tuítes, Olavo escreveu que o ministro “simplesmente não presta”, que “jamais terá coragem de discutir cara a cara” e que sem ele, Olavo, Santos Cruz “estaria (…) levando cusparadas na porta do Clube Militar e baixando a cabeça, como tantos de seus colegas de farda”.O general respondeu apenas “tenho muita coisa para fazer”. ",Brasil,Santos Cruz: Olavo de Carvalho ‘não tem importância nenhuma’,,05/04/2019 19:54:05
,https://www.oantagonista.com/brasil/de-temer-para-joesley-obrigado-ai-por-tudo-viu/,"Na reportagem “A festa do boi”, da Crusoé, Michel Temer cai num grampo da PF em conversa com Joesley Batista, na noite da reeleição de Dilma Rousseff, em 2014.Para comemorar a vitória da chapa PT-PMDB, financiada abundantemente pela JBS, Temer propõe a Joesley “aquele almoço ou jantar no Jaburu” e agradece: “Obrigado aí por tudo, viu?”Leia o trecho da reportagem de Mateus Coutinho:“Precisamente às 22h09, ele dispara uma ligação para um número de Brasília. Do outro lado, atende alguém com voz solene, que reconhece de pronto o número e fala de maneira carinhosa: “Oi, Ricardo”. “Michel?”, responde Saud. O interlocutor, então, parte direto para o agradecimento, sem dizer nada antes: “Obrigado, Ricardo”. Era Michel Temer, vice-presidente da República que acabara de ser reeleito juntamente com Dilma. Saud congratula o “amigo” pela vitória e logo passa o aparelho para Joesley. “Amigo, parabéns! Espere aí que vou passar para o chefe aqui. Espere aí que vou passar para o Joesley aqui. O Joesley está aqui, espere aí só um minutinho, só um minutinho.” “Maravilha, tá bom”, diz Temer. Joesley entra em cena. Temer o cumprimenta sem disfarçar a alegria. “Oi, Joesley.” O dono da JBS trata o vice como “chefe”. “Chefe, parabéns, hein!?”É quando surge na conversa um detalhe irônico. Temer o convida para um encontro no… Palácio do Jaburu, a residência oficial da Vice-Presidência da República: “Obrigadíssimo, amigo, obrigadíssimo. Agora, vem cá. Agora vamos fazer aquele almoço ou aquele jantar no Jaburu?”. “Pois é, pô!”, diz Joesley Batista. “Aquele churrasco ()”, emenda Temer. O dono da JBS reforça: “Temos que fazer em um fim de semana. Pega um fim de semana aí e nós vamos fazer”. “Vamos fazer, vamos fazer, tá bom? Obrigadíssimo aí por tudo, viu?”, diz o vice. “Estou aguardando o convite. Valeu, querido! Parabéns! Abração”, encerra Joesley. Quem sabe o que aconteceu quase dois anos depois em Brasília entende o quão irônica – e até profética – era essa conversa. Foi em um encontro justamente no Palácio do Jaburu, em março de 2017, que Joesley, já signatário de um acordo de delação premiada com a Procuradoria-Geral da República, usou um gravador escondido para registrar uma conversa pouco ortodoxa com Michel Temer, em que ambos tratavam da estratégia para evitar que a Lava Jato os alcançasse.”O áudio do grampo pode ser ouvido pelos assinantes na reportagem completa:",Brasil,"De Temer para Joesley: “Obrigado aí  por tudo, viu?”",,05/04/2019 19:05:39
,https://www.oantagonista.com/brasil/defesa-de-aecio-nega-que-campanha-tucana-tenha-recebido-repasse-de-propina-de-cabral/,"Como publicamos, Sérgio Cabral disse a Marcelo Bretas que repassou 1,5 milhão de reais de propina à campanha de Aécio Neves, em 2014.A defesa de Aécio enviou a seguinte nota:“O deputado Aécio Neves desconhece qualquer pedido de apoio feito pelo ex-governador do Rio para a campanha presidencial do PSDB em 2014.
Todas as doações realizadas àquela campanha estão devidamente declaradas e foram aprovadas pela Justiça Eleitoral.”",Brasil,Defesa de Aécio nega que campanha tucana tenha recebido repasse de propina de Cabral,,05/04/2019 19:23:51
Renan Ramalho,https://www.oantagonista.com/brasil/relato-de-cabral-sobre-indicacao-ao-stj-deixa-duvida/,"Ficou uma dúvida no relato de Sérgio Cabral sobre como, em 2011, t.No depoimento de hoje, o ex-governador disse que só o indicou devido à pressão e até ameaça por parte de Régis Fichtner, cunhado de Bellizze, e por isso, abriu mão de indicar para o posto de ministro o advogado Rodrigo Cândido de Oliveira, ex-sócio da mulher, Adriana Anselmo.Ocorre que Bellizze é oriundo do Judiciário — era desembargador do TJ-RJ — e não poderia disputar com um advogado a vaga aberta à época para o STJ, mas somente com outro desembargador.",Brasil,Relato de Cabral sobre indicação ao STJ deixa dúvida,,05/04/2019 20:10:33
,https://www.oantagonista.com/brasil/pilotos-da-fab-se-ejetaram-antes-da-queda/,"O Comando da Aeronáutica informa que dois pilotos da Força Aérea Brasileira (FAB) ejetaram-se, assim que detectaram uma falha técnica durante treinamento com o caça A-1 M.“A aeronave foi direcionada a uma região desabitada. Os pilotos passam bem e recebem acompanhamento médico. Equipes de investigação da FAB estão se deslocando até o local para apurar os fatores contribuintes da ocorrência.” ",Brasil,Pilotos da FAB se ejetaram antes da queda,,05/04/2019 19:41:24
,https://www.oantagonista.com/brasil/nao-quero-problema-com-a-palestina-afirma-bolsonaro/,"Jair Bolsonaro disse hoje não querer polêmica com a Palestina e afirmou que visitará “dois ou três” países árabes no início do segundo semestre, registra a Folha.Em visita a Israel no início da semana, o presidente anunciou a abertura de um escritório comercial do Brasil em Jerusalém, cidade alvo de disputa entre israelenses e palestinos. A medida foi criticada pela Autoridade Palestina.“Eu não quero problema com a Palestina. O povo palestino é maravilhoso, uma parte trabalha em Israel, escondido até, para não sofrer retaliação”, declarou Bolsonaro sobre o assunto.“A comunidade árabe é muito grande no Brasil –votaram em mim, (em) grande parte. Vamos continuar fazendo negócio com a Palestina, vamos ampliar até. Eu quero fazer negócio com o mundo todo”, acrescentou.",Brasil,"Não quero problema com a Palestina, afirma Bolsonaro",,05/04/2019 19:24:35
,https://www.oantagonista.com/mundo/eua-devem-classificar-guarda-revolucionaria-do-ira-como-terrorista/,"Os EUA devem designar a Guarda Revolucionária do Irã como uma organização terrorista, informaram à agência Reuters três autoridades norte-americanas.Se a medida for confirmada, será a primeira vez que Washington classifica formalmente militares de um outro país como um grupo terrorista.A Guarda Revolucionária é o braço das Forças Armadas iranianas responsável por manter o sistema implantado com a Revolução Islâmica de 1979 –o que inclui, entre outras tarefas, reprimir protestos. É a linha dura do regime.A decisão, afirma a agência de notícias, pode ser anunciada pelo Departamento de Estado dos EUA nesta segunda (8), antes do aniversário de um ano da retirada do acordo nuclear com o Irã por parte do governo de Donald Trump.",Mundo,EUA devem classificar Guarda Revolucionária do Irã como terrorista,,05/04/2019 20:29:29
,https://www.oantagonista.com/brasil/garotinho-nega-ser-dono-de-tv/,"Em nota publicada nas redes, Anthony e Rosinha Garotinho negaram recebimento de propina do setor de transporte no Rio, usada para comprar uma emissora de TV, como afirmou Sérgio Cabral hoje em depoimento.O ex-governador Anthony Garotinho é radialista com carteira assinada desde os 17 anos de idade. No entanto, nunca foi proprietário de emissora alguma”, diz a nota.“Depreende-se que o sentimento de ódio nutrido por Sérgio Cabral e seu grupo político advém da notícia crime protocolizada por Garotinho na Procuradoria Geral da República – PGR, onde teve início a investigação que levou Sérgio Cabral e seu grupo político à prisão.”",Brasil,Garotinho nega ser dono de TV,,05/04/2019 18:21:40
,https://www.oantagonista.com/brasil/bolsonaro-agora-vai-viajar-pelo-brasil/,"Depois de priorizar viagens internacionais em seus primeiros três meses de governo, Jair Bolsonaro deve viajar pelo Brasil, informa Igor Gadelha em .Os primeiros destinos nacionais do presidente nas próximas semanas serão Campina Grande e Macapá.Leia a reportagem:",Brasil,Bolsonaro agora vai viajar pelo Brasil,,05/04/2019 18:29:54
,https://www.oantagonista.com/brasil/senadora-nega-pressao-de-flavio-contra-cpi-da-lava-toga/,"Soraya Thronicke, senadora pelo PSL de Mato Grosso do Sul, negou ter sido pressionada por Flávio Bolsonaro para tirar sua assinatura do requerimento da CPI da Lava Toga.A afirmação havia sido feita por Alessandro Vieira, o autor do requerimento, .Leia o texto de Caio Junqueira:",Brasil,Senadora nega pressão de Flávio contra CPI da Lava Toga,,05/04/2019 18:59:27
,https://www.oantagonista.com/brasil/servidores-da-receita-acessaram-ilegalmente-dados-fiscais-de-bolsonaro-e-familia/,"A Receita Federal acaba de soltar nota informando que dois servidores acessaram ilegalmente informações fiscais de Jair Bolsonaro e familiares.O órgão abriu sindicância, que concluiu não haver “motivação legal para o acesso”. A Polícia Federal foi notificada.Confira a íntegra da nota:",Brasil,SERVIDORES DA RECEITA ACESSARAM ILEGALMENTE DADOS FISCAIS DE BOLSONARO E FAMÍLIA,,05/04/2019 18:57:04
,https://www.oantagonista.com/brasil/cabral-diz-ter-repassado-r-15-mi-em-propina-para-campanha-de-aecio/,"No depoimento de hoje a Marcelo Bretas, Sérgio Cabral também disse ter enviado à campanha de Aécio Neves à Presidência, em 2014, R$ 1,5 milhão oriundo do pagamento de propinas no Rio.“Ele [Aécio] estava meio deprimido, para baixo, a Marina [Silva] tinha ultrapassado ele”, afirmou o ex-governador do Rio ao juiz da Lava Jato.“Então pedi para procurarem o homem do dinheiro dele e encaminhei R$ 1,5 milhão”, acrescentou.",Brasil,"Cabral diz ter repassado R$ 1,5 mi em propina para campanha de Aécio",,05/04/2019 18:45:43
,https://www.oantagonista.com/sociedade/bolsonaro-oficializa-fim-do-horario-de-verao/,"O porta-voz da Presidência, Otávio do Rêgo Barros, informou hoje que não haverá horário de verão neste ano, registra o G1.Rêgo Barros oficializou declaração de Jair Bolsonaro –mais cedo, em seu café da manhã com jornalistas, o presidente disse que poderia encerrar o horário de verão ainda neste ano.Questionado sobre detalhes da medida, o porta-voz respondeu: “Esta é a posição para este ano. Para o próximo ano, faremos avaliação posterior”.Mais tarde, no Twitter, Bolsonaro detalhou a decisão:“Após estudos técnicos que apontam para a eliminação dos benefícios por conta de fatores como iluminação mais eficiente, evolução das posses, aumento do consumo de energia e mudança de hábitos da população, decidimos que não haverá horário de verão na temporada 2019/2020.”",Sociedade,Bolsonaro oficializa fim do horário de verão,,05/04/2019 17:44:05
,https://www.oantagonista.com/brasil/servidores-da-receita-teriam-acessado-dados-sigilosos-de-bolsonaro/,"Em O Globo, Lauro Jardim diz que a PF fez buscas em pelo menos um endereço da Receita Federal ontem, em Campinas.Segundo o colunista, a investigação da Inteligência da PF, “mantida sob a mais absoluta reserva”, mira em suspeitas de que dois servidores teriam usado o sistema do órgão para acessar dados fiscais sigilosos de Jair Bolsonaro.A Receita deve divulgar nota sobre o assunto ainda hoje.",Brasil,Servidores da Receita teriam acessado dados sigilosos de Bolsonaro,,05/04/2019 18:17:54
,https://www.oantagonista.com/brasil/familiares-querem-que-senador-ameacado-deixe-relatoria-do-pacote-anticrime/,"Familiares de Marcos do Val estão tentando convencer o senador a deixar uma das relatorias do pacote anticrime de Sergio Moro, depois das  sofridas pelo parlamentar por meio de um email apócrifo.Ele, porém, disse a  que não vai deixar a função e voltou a cobrar investigação da Polícia Legislativa do Senado, que não comentou o caso.",Brasil,Familiares querem que senador ameaçado deixe relatoria do pacote anticrime,,05/04/2019 18:14:06
,https://www.oantagonista.com/brasil/condenado-na-lava-jato-usa-fundo-como-argumento-para-suspeicao-de-forca-tarefa/,"Jorge Zelada, ex-diretor da área internacional da Petrobras condenado a 15 anos e 3 meses na Lava Jato, pediu a suspeição de toda a força-tarefa da operação, informa Fausto Macedo.Seus advogados alegaram que os procuradores da República do Paraná têm interesse em sua condenação, já que poderiam administrar os recursos oriundos de suas condenações.Os defensores de Zelada usaram como argumento o polêmico fundo bilionário –suspenso pelo STF– que receberia parte da multa de R$ 2,5 bilhões da Petrobrás nos EUA.",Brasil,Condenado na Lava Jato usa fundo como argumento para suspeição de força-tarefa,,05/04/2019 18:09:38
,https://www.oantagonista.com/brasil/podemos-tudo/,"Jair Bolsonaro resolveu negociar com os partidos para conseguir aprovar a reforma da Previdência.Mas precisa ficar esperto com o Podemos, que consegue estar ao mesmo tempo na base do governo e na oposição.O deputado Bacelar, do Podemos da Bahia, é vice-líder da minoria na Câmara – ou seja, oposição.Enquanto José Medeiros, do Podemos do Mato Grosso, é vice-líder do governo, escolhido pelo próprio presidente.",Brasil,Podemos tudo,,05/04/2019 18:09:19
,https://www.oantagonista.com/brasil/bolsonaro-diz-que-aguarda-pf-para-decidir-futuro-de-ministro-do-turismo/,"Jair Bolsonaro disse hoje que vai aguardar o relatório da Polícia Federal para decidir o destino de Marcelo Álvaro Antônio, registra o Estadão.A PF investiga a acusação de que o ministro do Turismo participou de um esquema para lançar candidaturas-laranjas do PSL, o partido do presidente, na campanha eleitoral do ano passado em Minas Gerais.“Vamos aguardar o relatório da Polícia Federal. Só com acusação não vale”, afirmou Bolsonaro. “Com o relatório em mãos, vamos analisar.”",Brasil,Bolsonaro diz que aguarda PF para decidir futuro de ministro do Turismo,,05/04/2019 16:52:50
,https://www.oantagonista.com/mundo/hamas-chama-flavio-bolsonaro-de-filho-de-extremista/,"O Hamas, grupo terrorista que controla a faixa de Gaza, respondeu ao tuíte publicado –e depois apagado– por Flávio Bolsonaro, que disse querer que o grupo “se exploda”, registra o Estadão.“O filho do extremista presidente brasileiro está atacando o Hamas porque rejeitamos o apoio ilimitado do novo governo brasileiro à ocupação israelense, que é uma contradição ao apoio histórico do Brasil ao povo palestino”, escreveu no Twitter Basem Naim, presidente do Conselho de Relações Internacionais do Hamas.“Jerusalém é um território ocupado, de acordo com o direito internacional, e ninguém, incluindo Jair Bolsonaro, tem o direito de legitimar a ocupação israelense”, acrescentou Naim.O grupo terrorista, evidentemente, é contra a transferência da embaixada brasileira de Tel Aviv para Jerusalém, aventada pelo presidente brasileiro.",Mundo,Hamas chama Flávio Bolsonaro de ‘filho de extremista’,,05/04/2019 17:49:42
,https://www.oantagonista.com/brasil/velez-ainda-estara-no-mec/,"Alessandro Molon, líder da oposição na Câmara, apresentou um requerimento (veja  a íntegra) para convocar Ricardo Vélez mais uma vez.A intenção, desta vez, é que o ministro explique sua ideia de substituir livros didáticos usados pelas escolas públicas.O pedido poderá ser votado na próxima terça-feira.A questão é saber se o colombiano ainda será ministro até lá.",Brasil,Vélez ainda estará no MEC?,,05/04/2019 16:54:24
,https://www.oantagonista.com/brasil/cabral-diz-que-fez-tratos-com-ministros-do-stj/,"No depoimento de hoje à Justiça Federal, Sérgio Cabral disse que em 2012 passou a ser achacado por parlamentares federais e teve que fazer tratos com ministros do Superior Tribunal de Justiça e do Tribunal de Contas da União.“O dinheiro a partir de 2012 deixa de ir para o exterior e passa a ser utilizado aqui. E até volta para ser usado na política. Eu fui achacado por parlamentares federais, eu tive que fazer tratos com ministros do TCU e do STJ”, disse, segundo registro da Folha.Em 2012, Cabral enfrentou uma crise política por causa da farra dos guardanapos em Paris.No depoimento de hoje, ele confirmou que indicou para o STJ o ministro Marco Aurélio Bellizze, nomeado em 2011 por Dilma Rousseff.Disse ter atuado por pressão e ameaça de Régis Fichtner, seu ex-chefe da Casa Civil, e abriu mão de indicar Rodrigo Cândido de Oliveira, ex-sócio da mulher, Adriana Anselmo.“Liguei para a presidente Dilma, e ela até disse que estava com o papel na mesa dela para assinar. Tive que fazer esse papelão de barrar o sócio da minha esposa para atender o Régis”, afirmou.",Brasil,Cabral diz que fez ‘tratos’ com ministros do STJ,,05/04/2019 17:00:32
,https://www.oantagonista.com/brasil/as-respostas-de-lula/,"Ao ser interrogado sobre o saque da Sete Brasil, Lula permaneceu calado, como registramos.O responsável pelo interrogatório era o delegado da PF Felipe Hille Pace, que revelou a planilha Amigo no departamento de propinas da Odebrecht.De fato, já temos todas as respostas.",Brasil,As respostas de Lula,,05/04/2019 16:57:05
,https://www.oantagonista.com/mundo/o-cracha-dos-milicianos-de-maduro/,"Os membros dos “coletivos”, as milícias paramilitares que disparam contra a população nos protestos contra a ditadura de Nicolás Maduro, têm crachá de identificação.O crachá “autoriza” o porte de armas de fogo.Leia a reportagem de Duda Teixeira em :",Mundo,O crachá dos milicianos de Maduro,,05/04/2019 17:19:29
,https://www.oantagonista.com/economia/o-campeao-dos-leiloes/,"O Ministério da Infraestrutura leiloou hoje mais seis terminais portuários no Pará, arrecadando quase R$ 450 milhões.Duas áreas foram arrematadas pela Petrobras, por meio da Transpetro e BR Distribuidora.Outras duas ficaram com o grupo Cosan, de Rubens Ometto, através da Petróleo Sabbá (Raízen) e do Consórcio Latitude (Ipiranga e Petróleo Sabbá). A Ipiranga levou outro terminal.Ometto tem sido o grande vitorioso dos leilões do atual governo. Em março, arrematou quatro terminais (Vitória e Paraíba) em consórcio com Ipiranga e BR Distribuidora.Na semana passada, o bilionário venceu o leilão da Ferrovia Norte-Sul, por meio da Rumo, subsidiária da Cosan.Leiam o que já publicamos sobre o tema:",Economia,O campeão dos leilões,,05/04/2019 17:31:54
,https://www.oantagonista.com/brasil/a-briga-na-esquerda-pelo-nordeste/,"Partidos de esquerda se articulam para tentar quebrar nas eleições municipais do ano que vem a quase hegemonia do PT no Nordeste.A ideia é isolar o partido na formação das coligações.Lideranças do PSB e do PDT, por exemplo, não aceitam que a legenda do presidiário ainda domine o cenário político em boa parte da região.",Brasil,A briga na esquerda pelo Nordeste,,05/04/2019 16:23:21
,https://www.oantagonista.com/brasil/a-forca-do-pp/,"A , como registramos há pouco, conta que, alguns dias atrás, em conversa reservada, Rodrigo Maia disse que “sem o PP não tem reforma”.Nos bastidores, algumas lideranças se referem ao líder do partido na Câmara, Arthur Lira, como “o novo Cunha”, em razão do poder de articulação do deputado. O mesmo se diz de Aguinaldo Ribeiro, ex-líder de Michel Temer e atual líder da maioria, com bom trânsito no Planalto.Na retaguarda, monitorando cada passo dessa dupla, está Ciro Nogueira, o senador piauiense que preside o partido e trabalha para que sua turma comande um novo centrão no Congresso.Há quase um ano, uma reportagem publicada na  mostrava em detalhes como o PP é o Partido da Propina. O texto continua atual:",Brasil,A força do PP,,05/04/2019 16:38:52
,https://www.oantagonista.com/brasil/huck-o-capitalismo-e-incrivel-mas-e-que-nem-uma-fera/,"Na Brasil Conference, organizada por Harvard e MIT, Luciano Huck também disse o seguinte:“Eu desconheço qualquer sistema que tenha sido mais eficiente que o capitalismo para resgatar gente da pobreza. Comunismo não deu certo. O capitalismo é incrível, mas é que nem uma fera, um leão. Se você não domar ele direito, ele vai nos devorar.”O problema no Brasil é que há muito domador para pouco leão. ",Brasil,"Huck: “O capitalismo é incrível, mas é que nem uma fera”",,05/04/2019 16:05:53
,https://www.oantagonista.com/brasil/fhc-bolsonaro-diz-que-1964-nao-foi-golpe-porque-ele-nao-estava-la/,"Fernando Henrique Cardoso também está participando da Brazil Conference, evento organizado por estudantes brasileiros de Harvard e do MIT nos EUA.Segundo a Folha, em dado momento, respondendo a uma pergunta, o tucano mencionou o golpe militar de 1964 e emendou:“Agora não se pode mais dizer golpe, porque o presidente atual diz que não foi golpe. Ele diz isso porque ele não estava lá” (Jair Bolsonaro tinha nove anos de idade em 1964).Em maio de 1969, FHC foi “compulsoriamente aposentado” e impedido pelo regime militar de dar aulas na USP.",Brasil,FHC: Bolsonaro diz que 1964 não foi golpe ‘porque ele não estava lá’,,05/04/2019 16:31:18
,https://www.oantagonista.com/brasil/bolsonaro-nao-nasci-para-ser-presidente/,"Jair Bolsonaro fez uma espécie de desabafo em discurso hoje no Planalto, na inauguração do Espaço de Atendimento de Ouvidoria da Presidência, informa o Estadão.“Desculpem as caneladas. Não nasci para ser presidente, nasci para ser militar”, disse o presidente.Em tom de brincadeira, Bolsonaro também afirmou: “Às vezes me pergunto, meu Deus, o que fiz para merecer isso? É só problema”.Mais tarde, depois do evento, o presidente negou que o cargo seja mais difícil do que ele imaginava e afirmou que “sabia das dificuldades, por ser um país grande”.Sobre a fala de que “não nasceu para presidente”, Bolsonaro disse, aos risos, que “tem que se virar para não ser engolido”.",Brasil,Bolsonaro: ‘Não nasci para ser presidente’,,05/04/2019 16:40:07
,https://www.oantagonista.com/brasil/policia-legislativa-nao-comenta-novas-ameacas-a-senador/,"Mais cedo,  revelou  que o senador Marcos do Val, um dos relatores do pacote anticrime de Sergio Moro, voltou a ser ameaçada por meio de um email apócrifo.A Polícia Legislativa, acionada novamente pelo parlamentar, informou, por meio da assessoria do Senado, que não comenta questões relativas à segurança dos senadores.A alegação é que “são questões sensíveis de segurança”.",Brasil,Polícia Legislativa não comenta novas ameaças a senador,,05/04/2019 16:04:03
,https://www.oantagonista.com/brasil/cabral-diz-que-crivella-recebeu-us-15-milhao-para-apoiar-paes-em-2008/,"Em seu depoimento de hoje a Marcelo Bretas, Sérgio Cabral disse que Marcelo Crivella recebeu US$ 1,5 milhão para apoiar Eduardo Paes no segundo turno da eleição de 2008.Naquele ano, Crivella, o atual prefeito, não conseguiu passar ao segundo turno, que seria disputado por Paes e Fernando Gabeira e vencido pelo então emedebista.Segundo o ex-governador do Rio, Crivella o procurou para falar que Armínio Fraga, que participava da campanha de Gabeira, ofereceu a ele US$ 1 milhão para apoiar o então adversário de Paes no segundo turno.Cabral afirmou ter combinado com Crivella que cobriria a proposta e procurado Eike Batista para conseguir os recursos. ",Brasil,"Cabral diz que Crivella recebeu US$ 1,5 milhão para apoiar Paes em 2008",,05/04/2019 15:52:28
,https://www.oantagonista.com/brasil/deputado-nomeia-cunhada-do-presidente-do-senado/,"Aliado de Davi Alcolumbre, o deputado André Abdon nomeou uma cunhada do presidente do Senado, Francilene Araújo Tobelém, como assessora de seu gabinete.Abdon disse não ter conhecimento da relação de parentesco e, depois, afirmou qye Francilene não será empossada.Leia o texto de Igor Gadelha em :",Brasil,Deputado nomeia cunhada do presidente do Senado,,05/04/2019 16:05:42
,https://www.oantagonista.com/brasil/garotinho-comprou-emissora-de-tv-com-propina-do-transporte-diz-cabral/,"No depoimento que presta hoje, Sérgio Cabral também disse que o ex-governador Anthony Garotinho comprou uma emissora de TV com propina do setor de transportes.“Com o dinheiro da Fetranspor, Garotinho comprou a TV Band no Sul Fluminense. Usa uma pessoa chamada Mauro como um testa de ferro, tem um jornal O Diário, que é do Mauro mas na verdade é dele (Garotinho), e eu continuo presidente da Alerj cuidando da caixinha da Fetranspor nesse período”, afirmou, segundo o G1.",Brasil,"Garotinho comprou emissora de TV com propina do transporte, diz Cabral",,05/04/2019 15:47:42
